ID,Text,Comment
Calloatti.Building.WarehousePile.DisplayName,"Warehouse Pile",
Calloatti.Building.WarehousePile.Description,"Stores bulky goods in a Warehouse",
Calloatti.Building.WarehousePile.FlavorDescription,"What's better than a pile? A warehouse pile",
Calloatti.Config.UseBagsForDirt.Label,"Use Bags For Dirt",
Calloatti.Config.UseBagsForDirt.Tooltip,"If true, Dirt will be visualized as bags instead of a pile.",
Calloatti.Config.StorageBuilding.MaxCapacity.Tooltip,"Sets the maximum capacity for this storage building.",
